qid,original_query,expanded_query
301,international organized crime,"international organized crime transnational criminal organizations drug trafficking cartels money laundering human trafficking smuggling networks mafia syndicates Interpol Europol law enforcement cross-border criminal enterprises racketeering illegal arms trade cybercrime operations criminal networks global crime syndicates narcotics"
302,poliomyelitis post polio,"poliomyelitis post polio post-polio syndrome PPS paralysis polio survivors muscle weakness fatigue respiratory problems iron lung vaccination eradication WHO Jonas Salk vaccine poliovirus neurological complications disability rehabilitation"
303,hubble telescope achievements,"hubble telescope achievements hubble space telescope NASA astronomical discoveries deep field images galaxy formation universe expansion rate cosmic observations nebulae photographs scientific breakthroughs space exploration Hubble constant stellar phenomena planetary observations Edwin Hubble servicing missions infrared imaging"
304,endangered species mammals,"endangered species mammals threatened wildlife extinction biodiversity conservation IUCN red list habitat loss poaching illegal hunting protected species wildlife preservation endangered animals rhinoceros elephant tiger panda gorilla ecosystem destruction deforestation"
305,dangerous vehicles,"dangerous vehicles unsafe cars automobile safety hazards vehicle defects rollover accidents SUV safety crash tests NHTSA recalls automotive defects tire blowouts brake failures consumer protection automobile industry safety ratings fatalities"
306,african civilian deaths,"african civilian deaths africa conflict casualties war victims genocide ethnic violence civil war humanitarian crisis refugees displaced persons mass atrocities Rwanda Burundi Congo Sudan Somalia ethnic cleansing peacekeeping military intervention"
307,new hydroelectric projects,"new hydroelectric projects hydroelectric power dams renewable energy electricity generation water power hydropower plants reservoir construction river systems environmental impact flood control irrigation power stations megawatts turbines"
308,implant dentistry,"implant dentistry dental implants tooth replacement oral surgery titanium implants osseointegration prosthetic teeth dentist oral health crown bridge dentures jaw bone periodontal endosseous implants restoration"
309,rap crime,"rap crime hip hop violence gangsta rap lyrics criminal activity rappers arrests murder shooting gang culture controversy censorship music industry violence glorification criminal records hip hop artists"
310,radio waves brain cancer,"radio waves brain cancer electromagnetic radiation cellular phones mobile devices health risks tumors glioma research studies epidemiology carcinogenic effects microwave radiation exposure limits safety concerns scientific evidence WHO IARC radiofrequency electromagnetic fields"
311,industrial espionage,"industrial espionage corporate espionage trade secrets theft intellectual property spying economic espionage competitive intelligence business secrets technology theft cybersecurity hacking corporate security confidential information proprietary data"
312,hydroponics,"hydroponics soilless cultivation hydroponic gardening plant growth nutrient solution water culture indoor farming greenhouse growing medium controlled environment agriculture vertical farming aeroponics aquaponics crop production"
313,magnetic levitation maglev,"magnetic levitation maglev maglev trains high-speed rail electromagnetic suspension superconducting magnets transportation technology bullet train levitation railway engineering Japan Germany Shanghai magnetic propulsion frictionless"
314,marine vegetation,"marine vegetation seaweed algae kelp aquatic plants ocean flora seagrass underwater ecosystems coral reefs phytoplankton marine biology coastal vegetation mangroves wetlands marine habitats biodiversity"
315,unexplained highway accidents,"unexplained highway accidents mysterious crashes road fatalities traffic incidents unknown causes automobile accidents investigation highway safety forensics vehicle malfunction driver behavior road conditions"
316,polygamy polyandry polygyny,"polygamy polyandry polygyny multiple marriage plural wives husbands bigamy marriage laws religious practices Mormon fundamentalist cultures tribal customs family structure marital arrangements legal status"
317,unsolicited faxes,"unsolicited faxes junk fax spam faxing telemarketing advertising unwanted communications consumer protection regulations FCC telecommunications harassment business promotion fax machines"
318,best retirement country,"best retirement country retirement destination expat retirees cost of living healthcare climate quality of life pension social security overseas retirement Costa Rica Panama Mexico Portugal Spain"
319,new fuel sources,"new fuel sources alternative energy renewable fuels biofuels solar wind hydrogen nuclear natural gas ethanol biodiesel clean energy sustainable power fossil fuel alternatives energy research"
320,undersea fiber optic cable,"undersea fiber optic cable submarine telecommunications transatlantic cables internet infrastructure data transmission underwater communications oceanic cable systems global connectivity bandwidth fiber optics international links"
321,women parliaments,"women parliaments female politicians legislative representation gender equality political participation women in government elected officials quota systems democracy voting rights women leaders congress senate"
322,international art crime,"international art crime art theft stolen paintings forgery cultural property trafficking antiquities looting museum heists Interpol FBI art squad Nazi-looted art repatriation black market"
323,literary journalistic plagiarism,"literary journalistic plagiarism copying intellectual property copyright infringement academic dishonesty writers journalists attribution fabrication ethics media scandals stolen work citations"
324,argentine british relations,"argentine british relations Argentina UK Falkland Islands Malvinas diplomatic relations sovereignty dispute military conflict 1982 war bilateral trade South Atlantic territorial claims"
325,cult lifestyles,"cult lifestyles religious cults sects brainwashing manipulation followers charismatic leaders alternative religions communes deprogramming mind control Jonestown Branch Davidians Heaven's Gate"
326,ferry sinkings,"ferry sinkings maritime disasters passenger ships capsizing drowning victims safety regulations overloading storms accidents Estonia Herald of Free Enterprise sea tragedies rescue operations"
327,modern slavery,"modern slavery human trafficking forced labor exploitation bonded labor sex trafficking migrant workers sweatshops child labor domestic servitude victims abolition human rights"
328,pope beatifications,"pope beatifications Catholic Church saints canonization Vatican religious ceremonies blessed martyrs miracles Pope John Paul II Catholic doctrine holy figures religious honors"
329,mexican air pollution,"mexican air pollution Mexico City smog air quality emissions vehicles industrial pollution respiratory health ozone environmental regulations PEMEX automobiles standards clean air"
330,iran iraq cooperation,"iran iraq cooperation Iranian Iraqi relations bilateral ties diplomatic relations Persian Gulf Middle East oil trade reconstruction post-war relations regional politics"
331,world bank criticism,"world bank criticism IMF international development lending policies structural adjustment poverty developing countries debt economic reform third world globalization Washington consensus"
332,income tax evasion,"income tax evasion tax fraud IRS tax avoidance offshore accounts tax shelters prosecution penalties audit criminal charges wealthy individuals corporations loopholes illegal"
333,antibiotics bacteria disease,"antibiotics bacteria disease antibiotic resistance superbugs infection treatment penicillin medication prescription drugs bacterial infections antimicrobial pharmaceutical overuse health care"
334,export controls cryptography,"export controls cryptography encryption technology national security regulations Wassenaar arrangement munitions software code ciphers data protection government restrictions international trade"
335,adoptive biological parents,"adoptive biological parents adoption family birth parents children foster care custody rights reunification open adoption sealed records identity biological connection"
336,black bear attacks,"black bear attacks bear encounters wildlife danger mauling injuries fatalities camping hiking national parks wildlife management human-bear conflict safety precautions"
337,viral hepatitis,"viral hepatitis hepatitis A B C liver disease infection vaccination transmission blood-borne illness chronic acute jaundice cirrhosis treatment prevention health"
338,risk aspirin,"risk aspirin side effects bleeding stomach ulcers heart attack stroke prevention blood thinner medication dosage health risks benefits pain relief"
339,alzheimers drug treatment,"alzheimers drug treatment Alzheimer's disease dementia medication memory loss cognitive decline brain disorder elderly patients clinical trials pharmaceutical therapy caregiving"
340,land mine ban,"land mine ban antipersonnel mines Ottawa Treaty international convention humanitarian demining victims amputees UXO clearance military weapons disarmament advocacy"
341,airport security,"airport security TSA screening metal detectors baggage check terrorism prevention hijacking passenger safety checkpoints X-ray scanners aviation security measures"
342,diplomatic expulsion,"diplomatic expulsion embassy personnel persona non grata foreign relations espionage international incident ambassador recall diplomatic crisis bilateral tensions"
343,police deaths,"police deaths law enforcement fatalities officers killed duty shootings ambush line of duty memorial fallen officers crime violence"
344,abuses e mail,"abuses e mail email harassment spam cyberbullying privacy invasion workplace misconduct electronic communication misuse internet abuse digital harassment"
345,overseas tobacco sales,"overseas tobacco sales cigarette exports international markets developing countries smoking health advertising regulations Philip Morris trade foreign markets"
346,educational standards,"educational standards school curriculum testing achievement academic performance national standards reform accountability student learning benchmarks assessment quality education"
347,wildlife extinction,"wildlife extinction endangered species habitat destruction biodiversity loss conservation animal protection ecosystem collapse human impact preservation threatened species"
348,agoraphobia,"agoraphobia anxiety disorder panic attacks fear public spaces mental health phobia psychological treatment therapy avoidance behavior psychiatry"
349,metabolism,"metabolism metabolic rate energy expenditure calories body weight nutrition digestion biochemistry cellular processes health diet exercise physiology"
350,health computer terminals,"health computer terminals VDT video display terminal ergonomics eye strain repetitive stress injury workplace health radiation carpal tunnel posture"
351,falkland petroleum exploration,"falkland petroleum exploration Falkland Islands oil gas drilling exploration rights British Argentina territorial waters South Atlantic energy reserves offshore"
352,british chunnel impact,"british chunnel impact Channel Tunnel Eurotunnel UK France transportation trade tourism economic effects cross-channel travel ferry competition rail link"
353,antarctica exploration,"antarctica exploration South Pole scientific research ice sheets climate study expeditions international treaty environmental protection geology wildlife penguins"
354,journalist risks,"journalist risks reporters danger press freedom war correspondents conflict zones violence threats murder press attacks media safety CPJ"
355,ocean remote sensing,"ocean remote sensing satellite imagery marine monitoring sea surface temperature oceanography environmental observation coastal mapping water quality space technology"
356,postmenopausal estrogen britain,"postmenopausal estrogen britain HRT hormone replacement therapy menopause women health treatment risks benefits osteoporosis breast cancer UK medical"
357,territorial waters dispute,"territorial waters dispute maritime boundaries exclusive economic zone EEZ international law UNCLOS sovereignty fishing rights continental shelf ocean claims"
358,blood alcohol fatalities,"blood alcohol fatalities drunk driving DUI DWI traffic deaths impaired driving BAC limit accidents victims MADD enforcement legislation"
359,mutual fund predictors,"mutual fund predictors investment performance stock market returns financial analysis portfolio management indicators forecasting metrics fund managers"
360,drug legalization benefits,"drug legalization benefits marijuana cannabis decriminalization policy reform harm reduction crime reduction taxation regulation medical marijuana recreational use"
361,clothing sweatshops,"clothing sweatshops garment workers labor exploitation factory conditions wages child labor developing countries Nike Gap outsourcing fair trade"
362,human smuggling,"human smuggling illegal immigration border crossing coyotes traffickers migrants refugees asylum seekers routes deaths enforcement organized crime"
363,transportation tunnel disasters,"transportation tunnel disasters tunnel fires accidents collapse subway metro rail road Mont Blanc Channel safety evacuation infrastructure"
364,rabies,"rabies viral disease animal bites dogs vaccination treatment symptoms fatal neurological hydrophobia prevention wildlife public health"
365,el nino,"el nino El Niño weather phenomenon Pacific Ocean climate patterns temperature rainfall drought floods ENSO La Niña atmospheric"
366,commercial cyanide uses,"commercial cyanide uses cyanide applications industrial mining gold extraction chemical manufacturing electroplating photography fumigation toxicity safety regulations"
367,piracy,"piracy maritime piracy pirates ships attacks Somalia hijacking ransoms naval patrols international waters cargo vessels armed robbery"
368,vitro fertilization,"vitro fertilization IVF fertility treatment assisted reproduction embryo implantation test tube babies infertility clinics eggs sperm pregnancy success rates"
369,anorexia nervosa bulimia,"anorexia nervosa bulimia eating disorders weight loss psychological body image mental health treatment therapy mortality hospitalization recovery"
370,food drug laws,"food drug laws FDA regulations safety standards labeling consumer protection pharmaceutical food additives approval process recalls enforcement"
371,health insurance holistic,"health insurance holistic alternative medicine coverage acupuncture chiropractic naturopathy wellness complementary therapies medical plans reimbursement"
372,native american casino,"native american casino Indian gaming tribal casinos gambling revenue sovereignty economic development reservation IGRA slots legal"
373,encryption equipment export,"encryption equipment export cryptography technology controls national security regulations software code international trade restrictions government policy"
374,nobel prize winners,"nobel prize winners Nobel laureates awards physics chemistry medicine literature peace economics Sweden Norway achievements recognition"
375,hydrogen energy,"hydrogen energy fuel cells clean energy renewable power alternative fuel technology vehicles storage production electrolysis green energy"
376,world court,"world court International Court of Justice ICJ Hague international law disputes nations legal rulings United Nations tribunals"
377,cigar smoking,"cigar smoking cigars tobacco health risks cancer mouth throat premium smoking culture Cuban industry regulation"
378,euro opposition,"euro opposition European currency Eurozone single currency EU monetary union Britain Denmark skepticism sovereignty economic concerns"
379,mainstreaming,"mainstreaming special education inclusion disabled students regular classrooms integration learning disabilities policy schools accommodation"
380,obesity medical treatment,"obesity medical treatment weight loss surgery gastric bypass drugs diet medication bariatric health overweight BMI therapy"
381,alternative medicine,"alternative medicine complementary therapy holistic healing acupuncture herbal remedies homeopathy naturopathy traditional medicine wellness health"
382,hydrogen fuel automobiles,"hydrogen fuel automobiles fuel cell vehicles cars clean energy emissions zero-emission transportation technology automakers future prototype"
383,mental illness drugs,"mental illness drugs psychiatric medication psychotropic antidepressants antipsychotics treatment therapy mental health disorders side effects"
384,space station moon,"space station moon lunar base NASA ISS international space station exploration colonization astronauts missions orbit research"
385,hybrid fuel cars,"hybrid fuel cars hybrid vehicles electric gas Toyota Prius fuel efficiency emissions automotive technology battery environmentally friendly"
386,teaching disabled children,"teaching disabled children special education learning disabilities inclusion IEP accommodations therapy intervention schools students educational"
387,radioactive waste,"radioactive waste nuclear waste disposal storage Yucca Mountain radiation contamination environmental hazards spent fuel repository safety"
388,organic soil enhancement,"organic soil enhancement composting fertilizer natural gardening agriculture soil health nutrients mulch sustainable farming amendments"
389,illegal technology transfer,"illegal technology transfer export violations military secrets espionage national security classified information foreign governments enforcement prosecution"
390,orphan drugs,"orphan drugs rare diseases pharmaceutical FDA approval treatment research development incentives patients medication biotechnology"
391,r d drug prices,"r d drug prices pharmaceutical research development costs medication pricing industry profits patents generic innovation healthcare"
392,robotics,"robotics robots automation artificial intelligence manufacturing technology industrial applications autonomous machines engineering future workplace"
393,mercy killing,"mercy killing euthanasia assisted suicide death right-to-die terminal illness compassionate ethics legal medical end-of-life"
394,home schooling,"home schooling homeschool education parents children curriculum teaching alternatives religious academic learning family instruction"
395,tourism,"tourism travel industry tourists destinations vacation hospitality economic impact international domestic hotels attractions revenue"
396,sick building syndrome,"sick building syndrome indoor air quality ventilation health symptoms offices buildings environmental illness headaches fatigue workplace"
397,automobile recalls,"automobile recalls car safety defects NHTSA manufacturer repairs vehicles consumer protection automotive industry problems airbags"
398,dismantling europes arsenal,"dismantling europes arsenal arms reduction nuclear weapons disarmament Cold War military treaties NATO Russia Germany conventional forces"
399,oceanographic vessels,"oceanographic vessels research ships marine science exploration ocean vessels scientific studies deep sea surveys oceanography fleet"
400,amazon rain forest,"amazon rain forest rainforest deforestation Brazil biodiversity environment conservation logging indigenous peoples ecosystem climate carbon"
401,foreign minorities germany,"foreign minorities germany immigrants Turkish guest workers integration asylum refugees citizenship discrimination xenophobia ethnic communities"
402,behavioral genetics,"behavioral genetics heredity genes behavior psychology nature nurture traits intelligence personality research science studies DNA"
403,osteoporosis,"osteoporosis bone loss density fractures calcium women elderly treatment prevention medication health aging skeletal disease"
404,ireland peace talks,"ireland peace talks Northern Ireland Good Friday Agreement IRA Sinn Fein UK British Protestant Catholic conflict resolution"
405,cosmic events,"cosmic events astronomy supernovae meteors asteroids comets solar eclipses celestial phenomena space universe stars galaxies"
406,parkinsons disease,"parkinsons disease Parkinson's neurological disorder tremors movement dopamine brain treatment medication symptoms therapy research"
407,poaching wildlife preserves,"poaching wildlife preserves illegal hunting endangered species ivory elephants rhinos conservation Africa enforcement rangers protection"
408,tropical storms,"tropical storms hurricanes typhoons cyclones weather severe storms flooding damage Caribbean Atlantic Pacific meteorology climate"
409,legal pan 103,"legal pan 103 Pan Am Flight 103 Lockerbie bombing Libya terrorism trial prosecution victims memorial justice"
410,schengen agreement,"schengen agreement Schengen Area EU border control free movement Europe passport visa travel integration European Union"
411,salvaging shipwreck treasure,"salvaging shipwreck treasure underwater archaeology sunken ships gold artifacts maritime history recovery salvage rights legal claims"
412,airport security,"airport security TSA screening terrorism prevention hijacking passenger safety aviation baggage checkpoint metal detectors X-ray"
413,steel production,"steel production manufacturing industry iron mills output capacity imports exports tariffs global trade foundry metal"
414,cuba sugar exports,"cuba sugar exports Cuban sugar industry harvest production trade economy Caribbean agriculture exports commodities"
415,drugs golden triangle,"drugs golden triangle opium heroin Myanmar Thailand Laos narcotics trafficking Southeast Asia poppy cultivation DEA"
416,three gorges project,"three gorges project Three Gorges Dam China Yangtze River hydroelectric power construction displacement environmental impact flooding"
417,creativity,"creativity innovation imagination artistic expression inspiration thinking problem-solving intelligence ideas originality psychology research"
418,quilts income,"quilts income quilt making crafts handmade textile art cottage industry income sales artisans folk art"
419,recycle automobile tires,"recycle automobile tires tire recycling rubber disposal environmental waste management retreading reuse products landfill"
420,carbon monoxide poisoning,"carbon monoxide poisoning CO gas toxic fumes deaths symptoms detectors heaters furnaces prevention safety awareness"
421,industrial waste disposal,"industrial waste disposal hazardous waste toxic materials pollution environmental regulations landfills treatment contamination cleanup EPA"
422,art stolen forged,"art stolen forged art theft forgery fake paintings fraud museums galleries authentication investigation criminal art crime"
423,milosevic mirjana markovic,"milosevic mirjana markovic Slobodan Milosevic wife Serbia Yugoslavia politics power couple war crimes Balkan influence"
424,suicides,"suicides suicide death mental health depression prevention crisis hotline self-harm statistics youth elderly methods"
425,counterfeiting money,"counterfeiting money fake currency bills Secret Service detection crime fraud printing prosecution security features"
426,law enforcement dogs,"law enforcement dogs K-9 police dogs drug detection bomb sniffing tracking search rescue training handlers"
427,uv damage eyes,"uv damage eyes ultraviolet radiation sunlight cataracts macular degeneration sunglasses protection vision eye health"
428,declining birth rates,"declining birth rates fertility population demographics family size aging society reproduction trends countries statistics"
429,legionnaires disease,"legionnaires disease Legionella bacteria pneumonia outbreak water systems air conditioning infection symptoms treatment prevention"
430,killer bee attacks,"killer bee attacks Africanized bees aggressive stings deaths swarm invasion spread Texas Arizona danger venom"
431,robotic technology,"robotic technology robots automation manufacturing artificial intelligence engineering industrial applications future machines innovation"
432,profiling motorists police,"profiling motorists police racial profiling traffic stops discrimination civil rights law enforcement minorities driving"
433,greek philosophy stoicism,"greek philosophy stoicism Stoics Marcus Aurelius Seneca Epictetus ancient philosophy ethics virtue wisdom teachings"
434,estonia economy,"estonia economy Estonian Baltic state transition former Soviet economic reform trade development EU growth"
435,curbing population growth,"curbing population growth population control family planning birth control developing countries policy China India demographics"
436,railway accidents,"railway accidents train crashes derailments rail safety transportation fatalities injuries infrastructure maintenance signals"
437,deregulation gas electric,"deregulation gas electric utilities energy markets competition pricing electricity natural gas power industry reform"
438,tourism increase,"tourism increase travel growth visitors destinations hospitality industry revenue economic impact international tourism"
439,inventions scientific discoveries,"inventions scientific discoveries innovation technology breakthroughs research development patents science progress advances"
440,child labor,"child labor children workers exploitation factories sweatshops developing countries education poverty laws enforcement"
441,lyme disease,"lyme disease tick-borne illness Borrelia bacteria symptoms treatment diagnosis chronic infection prevention deer ticks"
442,heroic acts,"heroic acts heroes bravery courage rescue saving lives medals recognition extraordinary selfless sacrifice"
