qid,original_query,expanded_query
443,investment africa,"investment africa foreign investment economic development business opportunities trade infrastructure growth capital markets"
444,supercritical fluids,"supercritical fluids supercritical CO2 extraction technology pressure temperature chemical processes industrial applications science"
445,women clergy,"women clergy female priests ministers ordination religion church gender equality religious leadership theology"
446,tourists violence,"tourists violence crime attacks travelers tourism safety danger foreign countries assaults robbery kidnapping"
447,stirling engine,"stirling engine heat engine thermodynamics energy conversion technology efficiency external combustion power generation"
448,ship losses,"ship losses maritime disasters sinkings vessels casualties cargo ships accidents storms collisions sea"
449,antibiotics ineffectiveness,"antibiotics ineffectiveness antibiotic resistance drug-resistant bacteria superbugs overuse medication infection treatment health crisis"
450,king hussein peace,"king hussein peace King Hussein Jordan Middle East peace process Israel relations diplomacy Arab leader treaty"
601,turkey iraq water,"turkey iraq water Euphrates Tigris rivers dams irrigation water rights disputes Middle East hydropolitics"
602,czech slovak sovereignty,"czech slovak sovereignty Czechoslovakia breakup Czech Republic Slovakia independence Velvet Divorce separation 1993"
603,tobacco cigarette lawsuit,"tobacco cigarette lawsuit smoking litigation lawsuits health damages industry companies settlement courts legal"
604,lyme disease arthritis,"lyme disease arthritis tick-borne illness joint pain inflammation chronic symptoms treatment diagnosis Borrelia"
605,great britain health care,"great britain health care NHS National Health Service UK British medical system hospitals doctors healthcare reform"
606,leg traps ban,"leg traps ban steel-jaw traps animal cruelty hunting wildlife fur trapping prohibition regulations humane"
607,human genetic code,"human genetic code genome DNA genes sequencing Human Genome Project genetics chromosomes mapping heredity science"
608,taxing social security,"taxing social security Social Security benefits taxes income retirees elderly taxation policy government revenue"
609,capita alcohol consumption,"capita alcohol consumption drinking rates per person statistics countries alcohol use patterns trends"
610,minimum wage adverse impact,"minimum wage adverse impact low wage workers employment effects job losses small business economic policy"
611,kurds germany violence,"kurds germany violence Kurdish community Germany PKK protests demonstrations Turkish conflict attacks"
612,tibet protesters,"tibet protesters Tibetan independence China demonstrations activists Dalai Lama human rights freedom movement"
613,berlin wall disposal,"berlin wall disposal Berlin Wall Germany pieces souvenir destruction fall 1989 concrete segments"
614,flavr savr tomato,"flavr savr tomato genetically modified GMO food biotechnology Calgene FDA approval agriculture engineering"
615,timber exports asia,"timber exports asia wood logging lumber trade Pacific Rim Japan China forestry deforestation"
616,volkswagen mexico,"volkswagen mexico VW automobile manufacturing Beetle Puebla factory workers production German automaker"
617,russia cuba economy,"russia cuba economy Russian Cuban relations trade Soviet era post-Cold War economic ties aid"
618,ayatollah khomeini death,"ayatollah khomeini death Khomeini Iran Islamic Revolution leader funeral successor Khamenei Iranian"
619,winnie mandela scandal,"winnie mandela scandal Winnie Mandela South Africa controversy ANC soccer team kidnapping trial"
620,france nuclear testing,"france nuclear testing French nuclear tests Pacific Mururoa atoll protests atomic weapons underground"
621,women ordained church england,"women ordained church england Anglican Church female priests ordination controversy clergy religion gender"
622,price fixing,"price fixing antitrust collusion illegal conspiracy cartel pricing competition DOJ prosecution business"
623,toxic chemical weapon,"toxic chemical weapon chemical weapons CW nerve gas mustard gas warfare prohibited treaties disarmament"
624,sdi star wars,"sdi star wars Strategic Defense Initiative missile defense Reagan Cold War military space lasers"
625,arrests bombing wtc,"arrests bombing wtc World Trade Center bombing 1993 terrorists arrests FBI investigation prosecution"
626,human stampede,"human stampede crowd crush deaths trampling panic stadium events concerts pilgrimage Mecca safety"
627,russian food crisis,"russian food crisis Russia food shortage famine agriculture hunger aid imports economic collapse"
628,invasion panama,"invasion panama US invasion Operation Just Cause Noriega military intervention 1989 American forces"
629,abortion clinic attack,"abortion clinic attack violence bombing shooting protesters doctors clinic security anti-abortion pro-life"
630,gulf war syndrome,"gulf war syndrome Gulf War illness veterans symptoms chemical exposure health mysterious Desert Storm"
631,mandela south africa president,"mandela south africa president Nelson Mandela ANC apartheid democracy election 1994 South African leader"
632,southeast asia tin mining,"southeast asia tin mining tin production Malaysia Indonesia Thailand mining industry exports metal"
633,welsh devolution,"welsh devolution Wales autonomy UK devolved government assembly self-governance referendum British constitution"
634,l tryptophan deaths,"l tryptophan deaths L-tryptophan supplements contamination eosinophilia-myalgia syndrome EMS FDA recall health"
635,doctor assisted suicides,"doctor assisted suicides physician-assisted death euthanasia right-to-die terminal illness Kevorkian Oregon Death with Dignity"
636,jury duty exemptions,"jury duty exemptions jury service excuse exceptions hardship occupation age civic duty court legal"
637,human growth hormone hgh,"human growth hormone hgh HGH growth hormone therapy children dwarfism athletics doping synthetic treatment"
638,wrongful convictions,"wrongful convictions innocent prisoners exoneration DNA evidence false imprisonment injustice appeals Innocence Project"
639,consumer line shopping,"consumer line shopping online shopping e-commerce internet retail consumers purchasing electronic commerce web"
640,maternity leave policies,"maternity leave policies parental leave employment benefits women workers family medical leave act pregnancy"
641,valdez wildlife marine life,"valdez wildlife marine life Exxon Valdez oil spill Alaska environmental damage cleanup seabirds otters fish"
642,tiananmen square protesters,"tiananmen square protesters Tiananmen Square 1989 China democracy movement massacre students Beijing protests crackdown"
643,salmon dams pacific northwest,"salmon dams pacific northwest salmon Columbia River Snake River fish passage endangered species hydroelectric"
644,exotic animals import,"exotic animals import wildlife trade pets smuggling endangered species regulations CITES illegal trafficking"
645,software piracy,"software piracy illegal copying programs copyright infringement intellectual property bootleg counterfeiting enforcement"
646,food stamps increase,"food stamps increase SNAP benefits welfare nutrition assistance program poverty hunger government aid"
647,windmill electricity,"windmill electricity wind power turbines renewable energy generation clean power farms wind energy"
648,family leave law,"family leave law FMLA Family and Medical Leave Act parental leave employment workers benefits policy"
649,computer viruses,"computer viruses malware cyber security infections software hackers antivirus protection threats attacks code"
650,tax evasion indicted,"tax evasion indicted tax fraud prosecution IRS criminal charges wealthy individuals penalties illegal"
651,ethnic population,"ethnic population demographics minorities racial groups census diversity immigration statistics communities"
652,oic balkans 1990s,"oic balkans 1990s Organization of Islamic Conference Yugoslavia Bosnia Muslim Kosovo conflict war intervention"
653,eta basque terrorism,"eta basque terrorism ETA Basque separatist Spain bombings attacks independence movement violence"
654,sex schools,"sex schools sex education curriculum students teaching health contraception abstinence controversy programs"
655,add diagnosis treatment,"add diagnosis treatment ADHD attention deficit hyperactivity disorder children medication Ritalin behavior therapy"
656,lead poisoning children,"lead poisoning children lead exposure paint contamination health effects blood levels prevention screening"
657,school prayer banned,"school prayer banned prayer in schools Supreme Court religion First Amendment separation church state"
658,teenage pregnancy,"teenage pregnancy teen mothers adolescent youth birth rates prevention education health welfare"
659,cruise health safety,"cruise health safety cruise ship illness outbreaks norovirus sanitation passengers CDC inspections"
660,whale watching california,"whale watching california whales tourism Pacific Ocean migration gray whales blue whales boats ecotourism"
661,melanoma treatment causes,"melanoma treatment causes skin cancer sun exposure UV radiation treatment surgery chemotherapy prevention"
662,telemarketer protection,"telemarketer protection telemarketing calls do-not-call registry consumer rights privacy regulations FTC harassment"
663,agent orange exposure,"agent orange exposure Vietnam veterans herbicide health effects dioxin cancer birth defects VA claims"
664,american indian museum,"american indian museum Native American museums artifacts culture history Smithsonian NMAI collections exhibitions"
665,poverty africa sub sahara,"poverty africa sub sahara Sub-Saharan Africa poverty development aid hunger malnutrition economic crisis"
666,thatcher resignation impact,"thatcher resignation impact Margaret Thatcher UK Prime Minister resignation 1990 Conservative Party legacy Britain"
667,unmarried partner households,"unmarried partner households cohabitation unmarried couples living together domestic partnership census statistics relationships"
668,poverty disease,"poverty disease health illness developing countries malnutrition infectious diseases access healthcare mortality"
669,islamic revolution,"islamic revolution Iran 1979 Khomeini Shah Islamic Republic revolution Iranian theocracy"
670,elections apathy,"elections apathy voter turnout low participation apathy democracy voting civic engagement political"
671,salvation army benefits,"salvation army benefits Salvation Army charity services homeless assistance social programs religious organization"
673,soviet withdrawal afghanistan,"soviet withdrawal afghanistan Soviet Afghan war 1989 Red Army pullout mujahideen Cold War"
674,greenpeace prosecuted,"greenpeace prosecuted Greenpeace legal action prosecution environmental activism protests arrests criminal charges"
675,olympics training swimming,"olympics training swimming Olympic swimmers athletes training competition medals world records sports"
676,poppy cultivation,"poppy cultivation opium poppies heroin Afghanistan drug production narcotics DEA eradication farming"
677,leaning tower pisa,"leaning tower pisa Pisa Italy tower tilt restoration architecture tourism landmark engineering"
678,joint custody impact,"joint custody impact shared custody children divorce parents family law effects co-parenting"
679,opening adoption records,"opening adoption records adoption records access birth parents sealed records rights search reunion"
680,immigrants spanish school,"immigrants spanish school bilingual education immigrant children Hispanic students ESL language learning"
681,wind power location,"wind power location wind farms siting turbines renewable energy generation capacity sites locations"
682,adult immigrants english,"adult immigrants english ESL English language learning immigrants education literacy programs classes"
683,czechoslovakia breakup,"czechoslovakia breakup Czechoslovakia dissolution Czech Slovakia Velvet Divorce 1993 independence separation"
684,part time benefits,"part time benefits part-time workers employment healthcare insurance wages compensation labor rights"
685,oscar winner selection,"oscar winner selection Academy Awards voting members selection process films actors nominees Hollywood"
686,argentina pegging dollar,"argentina pegging dollar Argentina currency convertibility peso dollar peg economic crisis devaluation"
687,northern ireland industry,"northern ireland industry Northern Ireland economy manufacturing employment investment business development UK"
688,non media bias,"non media bias news media objectivity bias journalism reporting coverage political fairness"
689,family planning aid,"family planning aid family planning foreign aid USAID population programs contraception developing countries"
690,college education advantage,"college education advantage higher education benefits degree earnings employment graduates career success"
691,clear cutting forests,"clear cutting forests deforestation logging forestry environmental damage timber industry ecosystem destruction"
692,prostate cancer detection treatment,"prostate cancer detection treatment prostate cancer PSA test screening treatment surgery radiation therapy men health"
693,newspapers electronic media,"newspapers electronic media print journalism internet online news digital media industry decline future"
694,compost pile,"compost pile composting organic waste gardening decomposition soil fertilizer recycling yard waste"
695,white collar crime sentence,"white collar crime sentence corporate crime fraud embezzlement sentencing punishment prosecution prison business"
696,safety plastic surgery,"safety plastic surgery cosmetic surgery risks complications procedures breast implants face-lift health safety"
697,air traffic controller,"air traffic controller ATC aviation safety airports FAA controllers strikes stress radar flights"
698,literacy rates africa,"literacy rates africa African literacy education reading writing rates schools development statistics"
699,term limits,"term limits political office limits elected officials restrictions congress state legislators incumbents democracy"
700,gasoline tax,"gasoline tax fuel tax gas prices transportation highway funding federal state revenue policy"
